{
  "schema_version": "forge.visual_judge.v1",
  "rubric_version": "forge.visual_judge.rubric.v1",
  "stage": "pre_native",
  "verdict": "pass",
  "confidence": "high",
  "app": {
    "id": "pet-care-relay",
    "name": "Pet Care Relay",
    "run_id_or_fixture": "visual-judge-pre-native-pass"
  },
  "inputs": {
    "visual_evidence_packet": ".forge/design/visual-evidence-packet.json",
    "references": ".forge/design/references.json",
    "original_synthesis": ".forge/design/original-synthesis.json",
    "prototype_receipt": ".forge/design/prototype/prototype-receipt.json",
    "design_system": ".forge/design/design-system.json"
  },
  "score_thresholds": {
    "total_pass_min": 80,
    "hard_minimums": {
      "reference_quality": 8,
      "original_synthesis": 10,
      "first_screen_specificity": 11,
      "workflow_shape": 9,
      "native_ios_craft": 7,
      "visual_hierarchy_density": 7,
      "emotional_tone_copy": 6,
      "evidence_integrity": 8,
      "distinctiveness_non_bullshit": 8
    },
    "dimension_maxima": {
      "reference_quality": 12,
      "original_synthesis": 14,
      "first_screen_specificity": 14,
      "workflow_shape": 12,
      "native_ios_craft": 10,
      "visual_hierarchy_density": 10,
      "emotional_tone_copy": 8,
      "evidence_integrity": 10,
      "distinctiveness_non_bullshit": 10
    },
    "hard_fail_policy": "any_hard_fail_blocks_even_if_total_score_passes"
  },
  "scores": {
    "reference_quality": 10,
    "original_synthesis": 12,
    "first_screen_specificity": 12,
    "workflow_shape": 10,
    "native_ios_craft": 7,
    "visual_hierarchy_density": 8,
    "emotional_tone_copy": 7,
    "evidence_integrity": 9,
    "distinctiveness_non_bullshit": 9,
    "total": 84
  },
  "hard_fails": [],
  "comparison_summary": "References, synthesis, and prototype form a named-pet relay surface with concrete care states; no native screenshot claim is made at this stage.",
  "dimension_findings": [
    {
      "dimension": "reference_quality",
      "score": 10,
      "max": 12,
      "hard_min": 8,
      "status": "pass",
      "evidence": [
        "References are public, attributed, category-relevant, and transformed rather than copied."
      ]
    },
    {
      "dimension": "original_synthesis",
      "score": 12,
      "max": 14,
      "hard_min": 10,
      "status": "pass",
      "evidence": [
        "Borrow/avoid/transform logic yields a product-specific visual metaphor and concrete signature surfaces."
      ]
    },
    {
      "dimension": "first_screen_specificity",
      "score": 12,
      "max": 14,
      "hard_min": 11,
      "status": "pass",
      "evidence": [
        "The first screen proves the app category/job above the fold without noun-swap dashboard genericism."
      ]
    },
    {
      "dimension": "workflow_shape",
      "score": 10,
      "max": 12,
      "hard_min": 9,
      "status": "pass",
      "evidence": [
        "Activation, action, changed state, and returning-progress loop are visible in artifacts, not only prose."
      ]
    },
    {
      "dimension": "native_ios_craft",
      "score": 7,
      "max": 10,
      "hard_min": 7,
      "status": "pass",
      "evidence": [
        "Native hierarchy, accessibility, touch targets, and platform conventions support the design instead of flattening it."
      ]
    },
    {
      "dimension": "visual_hierarchy_density",
      "score": 8,
      "max": 10,
      "hard_min": 7,
      "status": "pass",
      "evidence": [
        "One dominant job is visually prioritized; density is intentional, not equal-card soup."
      ]
    },
    {
      "dimension": "emotional_tone_copy",
      "score": 7,
      "max": 8,
      "hard_min": 6,
      "status": "pass",
      "evidence": [
        "Copy reflects the user anxiety/relief and avoids generic SaaS filler."
      ]
    },
    {
      "dimension": "evidence_integrity",
      "score": 9,
      "max": 10,
      "hard_min": 8,
      "status": "pass",
      "evidence": [
        "Artifacts are current, path-indexed, and sufficient for retryable judgment."
      ]
    },
    {
      "dimension": "distinctiveness_non_bullshit",
      "score": 9,
      "max": 10,
      "hard_min": 8,
      "status": "pass",
      "evidence": [
        "Removing labels would still leave a recognizable product-specific shape."
      ]
    }
  ],
  "repair_requests": [],
  "next_gate": "native_expansion",
  "next_gate_allowed": true,
  "human_gate_allowed": false,
  "safety": {
    "no_paid_or_account_actions": true,
    "references_are_research_only": true,
    "no_reference_assets_copied": true,
    "notes": [
      "Fixture data only; no native app generated and no external action performed."
    ]
  }
}
